{"artifact_type":"evidence_gap_review_and_targeted_research_design","content_hash":"03147ad8ca5e85150faf5f28db0a14f9650aca60164a0283a45aad23cae720ce","cross_level_inference_rules":[{"from_level":"technical_parameter_or_mechanism","prohibited_target_level":"manufacturing_bottleneck","reason":"Manufacturing-process capability, tolerance, reliability and production evidence are separately required.","rule_id":"LEVEL-01"},{"from_level":"manufacturing_difficulty","prohibited_target_level":"effective_capacity_shortage","reason":"Qualified yield, utilization, product mix, qualification and output denominators are separately required.","rule_id":"LEVEL-02"},{"from_level":"effective_capacity_constraint","prohibited_target_level":"commercial_supply_bottleneck","reason":"Matched demand, delivery, lead-time, duration and substitution evidence are separately required.","rule_id":"LEVEL-03"},{"from_level":"commercial_supply_bottleneck","prohibited_target_level":"value_migration","reason":"Cost, price, bargaining power, margin and profit-allocation evidence are separately required.","rule_id":"LEVEL-04"},{"from_level":"industry_conclusion","prohibited_target_level":"company_benefit","reason":"Company product, qualification, capacity, order, revenue and profit evidence are separately required.","rule_id":"LEVEL-05"},{"from_level":"company_capability","prohibited_target_level":"stock_investment_value","reason":"Valuation, expectations, catalysts, risk and time-window evidence are separately required.","rule_id":"LEVEL-06"}],"evidence_requirements":[{"claim_scope":"atomic_research_design_requirement","comparison_scope":"One named interface generation and one defined board/channel topology.","contradiction_rule":"Search for a conflicting measurement, alternative mechanism, boundary condition or incompatible denominator from a substantively independent evidence chain.","denominator_rule":"per channel, per lane and per named interface generation","er_id":"PCB-ER-A01","freshness_rule":"Use the applicable standard revision and match interface generation, frequency range, product class and observation period; unknown dates cannot establish current applicability.","gap_id":"GAP-SIGNAL","maximum_supported_cognition_level":"technical_understanding","minimum_independent_evidence_chains":2,"prohibited_inferences":["Technical difficulty does not establish a manufacturing bottleneck.","Manufacturing difficulty does not establish insufficient qualified effective capacity.","Effective-capacity limits do not establish price, margin or value migration.","Industry evidence does not establish a specific company's exposure or investment value."],"required_fact_types":["interface generation","channel topology","electrical reach","endpoint definition","operating conditions"],"required_source_classes":["technical_standard","official_interface_specification"],"research_question":"What channel endpoints, topology, electrical reach, signaling generation and operating conditions define the scoped comparison?","stop_rule":"Stop when the scoped channel is unambiguous; stop due to scope if product generation or topology cannot be fixed.","sufficiency_rule":"A normative definition and an independent engineering interpretation agree on endpoints, topology, rate and measurement conditions.","supplier_independent_source_required":true},{"claim_scope":"atomic_research_design_requirement","comparison_scope":"Same channel class measured at comparable rates or reaches.","contradiction_rule":"Search for a conflicting measurement, alternative mechanism, boundary condition or incompatible denominator from a substantively independent evidence chain.","denominator_rule":"per lane at specified frequency/rate, length and fixture de-embedding method","er_id":"PCB-ER-A02","freshness_rule":"Use the applicable standard revision and match interface generation, frequency range, product class and observation period; unknown dates cannot establish current applicability.","gap_id":"GAP-SIGNAL","maximum_supported_cognition_level":"technical_understanding","minimum_independent_evidence_chains":2,"prohibited_inferences":["Technical difficulty does not establish a manufacturing bottleneck.","Manufacturing difficulty does not establish insufficient qualified effective capacity.","Effective-capacity limits do not establish price, margin or value migration.","Industry evidence does not establish a specific company's exposure or investment value."],"required_fact_types":["insertion loss measurement","return loss measurement","crosstalk measurement","jitter or eye metric","test method"],"required_source_classes":["technical_standard","peer_reviewed_engineering","test_equipment_engineering"],"research_question":"Under the scoped channel, how do measured compliance variables change across data rate or reach?","stop_rule":"Stop when comparable measurements satisfy the minimum; stop due to denominator if fixtures, frequency or reach cannot be reconciled.","sufficiency_rule":"At least one direct measurement with method plus one independent corroborating chain provides comparable variables and uncertainty.","supplier_independent_source_required":true},{"claim_scope":"atomic_research_design_requirement","comparison_scope":"Same interface family with explicitly different topology, equalization or reach.","contradiction_rule":"Search for a conflicting measurement, alternative mechanism, boundary condition or incompatible denominator from a substantively independent evidence chain.","denominator_rule":"per normalized channel condition","er_id":"PCB-ER-A03","freshness_rule":"Use the applicable standard revision and match interface generation, frequency range, product class and observation period; unknown dates cannot establish current applicability.","gap_id":"GAP-SIGNAL","maximum_supported_cognition_level":"technical_understanding","minimum_independent_evidence_chains":2,"prohibited_inferences":["Technical difficulty does not establish a manufacturing bottleneck.","Manufacturing difficulty does not establish insufficient qualified effective capacity.","Effective-capacity limits do not establish price, margin or value migration.","Industry evidence does not establish a specific company's exposure or investment value."],"required_fact_types":["boundary condition","alternative topology","equalization condition","measurement uncertainty"],"required_source_classes":["peer_reviewed_engineering","technical_standard","independent_engineering_validation"],"research_question":"Which boundary conditions or alternative explanations limit a claimed rate-to-signal-integrity relationship?","stop_rule":"Stop when further sources repeat the same experiment or no longer change the identified boundary conditions.","sufficiency_rule":"A supporting relationship and at least one independent limiting or counter case are both scoped.","supplier_independent_source_required":true},{"claim_scope":"atomic_research_design_requirement","comparison_scope":"One measurement method applied to a defined PCB channel or coupon.","contradiction_rule":"Search for a conflicting measurement, alternative mechanism, boundary condition or incompatible denominator from a substantively independent evidence chain.","denominator_rule":"dB per specified length at specified frequency and test method","er_id":"PCB-ER-A04","freshness_rule":"Use the applicable standard revision and match interface generation, frequency range, product class and observation period; unknown dates cannot establish current applicability.","gap_id":"GAP-LOSS","maximum_supported_cognition_level":"technical_understanding","minimum_independent_evidence_chains":2,"prohibited_inferences":["Technical difficulty does not establish a manufacturing bottleneck.","Manufacturing difficulty does not establish insufficient qualified effective capacity.","Effective-capacity limits do not establish price, margin or value migration.","Industry evidence does not establish a specific company's exposure or investment value."],"required_fact_types":["loss definition","frequency point or band","test coupon geometry","fixture removal method","temperature condition"],"required_source_classes":["technical_standard","test_equipment_engineering"],"research_question":"What definition and test method make insertion-loss values comparable?","stop_rule":"Stop due to denominator when loss values lack compatible frequency, length or method.","sufficiency_rule":"A normative method and an independent implementation guide define comparable units, frequency, geometry and de-embedding.","supplier_independent_source_required":true},{"claim_scope":"atomic_research_design_requirement","comparison_scope":"Matched coupons or models changing one declared variable at a time.","contradiction_rule":"Search for a conflicting measurement, alternative mechanism, boundary condition or incompatible denominator from a substantively independent evidence chain.","denominator_rule":"loss per unit length at matched frequency, geometry, copper weight and method","er_id":"PCB-ER-A05","freshness_rule":"Use the applicable standard revision and match interface generation, frequency range, product class and observation period; unknown dates cannot establish current applicability.","gap_id":"GAP-LOSS","maximum_supported_cognition_level":"technical_understanding","minimum_independent_evidence_chains":2,"prohibited_inferences":["Technical difficulty does not establish a manufacturing bottleneck.","Manufacturing difficulty does not establish insufficient qualified effective capacity.","Effective-capacity limits do not establish price, margin or value migration.","Industry evidence does not establish a specific company's exposure or investment value."],"required_fact_types":["dielectric-loss measurement","conductor-loss measurement","surface-profile measurement","geometry-controlled comparison"],"required_source_classes":["peer_reviewed_engineering","independent_material_test","technical_standard"],"research_question":"Within a controlled